{
  "schema": "app-role-capability-catalog.v1",
  "plugin_id": "bears-app-based-workflow",
  "models": [
    "gpt-5.6-luna",
    "gpt-5.6-sol",
    "gpt-5.6-terra"
  ],
  "reasoning_efforts": [
    "high",
    "low",
    "max",
    "medium"
  ],
  "native_tools": [
    "apply_patch",
    "collaboration.followup_task",
    "collaboration.interrupt_agent",
    "collaboration.list_agents",
    "collaboration.send_message",
    "collaboration.spawn_agent",
    "collaboration.wait_agent",
    "exec_command",
    "request_user_input",
    "web.open",
    "web.search_query",
    "write_stdin"
  ],
  "skills": [
    "app-analyze",
    "app-constitution",
    "app-context-index",
    "app-dev",
    "app-functional-graph",
    "app-graph-compile",
    "app-plan",
    "app-research",
    "app-solo-route",
    "app-specify",
    "instruction-hardening",
    "role-profile-maintenance",
    "subagents"
  ],
  "mcp_servers": {
    "app-graph": {
      "classification": "read-only",
      "tools": [
        "dependency_slice",
        "graph_diagnostics",
        "graph_trace",
        "impact_analysis",
        "topological_plan",
        "workflow_state"
      ]
    },
    "app-graph-maintainer": {
      "classification": "maintainer",
      "tools": [
        "graph_compile",
        "process_record_event"
      ]
    }
  }
}
